{
 "format": "base-verdict/v0",
 "verdict_id": "eth3d-facade/gt-laser/C1-rules-hs11/angle75",
 "scene": {
  "scene_id": "eth3d-facade/gt-laser",
  "site": "eth3d-facade",
  "sha256": "00e3eabe293223d7bd87f86dde97041e75577205f4fa9e93c494cf4111bc309f",
  "producer_path": "gt-laser",
  "data": "real"
 },
 "evaluator": {
  "path": "C1-rules-hs11",
  "version": "PR #11 t3/server @ cd0da8b",
  "rules_profile": "demo",
  "rules_sha256": "68693248e605d4252cd14dd74afd2e4e042408b9632612a0a4ac6dc5a708da2b",
  "auto_approve": true,
  "runtime_s": 5.78,
  "ground_rule": "angle75",
  "ground_incidence_deg": 75.0
 },
 "site": {
  "decision": "manual_review",
  "reasons": [
   "all_spots_fail",
   "coverage_downgrade"
  ],
  "chosen_candidate": null
 },
 "criteria": [
  {
   "id": "wall_backing",
   "scope": "candidate",
   "candidate_id": "spot",
   "outcome": "pass",
   "reason": "The whole footprint backs onto one straight, observed wall segment.",
   "measured": null,
   "threshold": null,
   "fact": {
    "value": true,
    "clean": true,
    "raw": "pass",
    "coverage": [
     {
      "region": {
       "wall_id": "w1",
       "s_m": [
        -3.7793972584000004,
        -1.1719973600000002
       ],
       "height_m": [
        0.05,
        2.13
       ]
      },
      "status": "observed",
      "probes": 567,
      "observed_share": 1.0,
      "seen_share": 1.0,
      "views_min": 3,
      "views_median": 7.0,
      "best_incidence_deg": 4.0,
      "worst_best_incidence_deg": 17.8,
      "rule": {
       "min_views": 2,
       "surface": "wall",
       "max_incidence_deg": 75.0,
       "observed_share": 0.9
      },
      "method": "evalharness.coverage.query_region"
     }
    ]
   }
  },
  {
   "id": "ground_surface",
   "scope": "candidate",
   "candidate_id": "spot",
   "outcome": "unsure",
   "reason": "The ground under the footprint was not seen.",
   "measured": null,
   "threshold": null,
   "unsure_cause": "unobserved"
  },
  {
   "id": "meter_working_space",
   "scope": "candidate",
   "candidate_id": "spot",
   "outcome": "pass",
   "reason": "The battery is 5 ft 7 in clear of the meter's 2 ft 6 in wide by 3 ft 0 in deep working space.",
   "measured": {
    "value_ft": 5.5807,
    "plus_minus_ft": 0.3983,
    "coverage": [
     {
      "region": {
       "wall_id": "w1",
       "s_m": [
        -3.7793972584000004,
        -1.1719973600000002
       ],
       "height_m": [
        0.05,
        2.13
       ]
      },
      "status": "observed",
      "probes": 567,
      "observed_share": 1.0,
      "seen_share": 1.0,
      "views_min": 3,
      "views_median": 7.0,
      "best_incidence_deg": 4.0,
      "worst_best_incidence_deg": 17.8,
      "rule": {
       "min_views": 2,
       "surface": "wall",
       "max_incidence_deg": 75.0,
       "observed_share": 0.9
      },
      "method": "evalharness.coverage.query_region"
     }
    ],
    "subject": "meter"
   },
   "threshold": {
    "value_ft": 0.0,
    "comparison": "at_least",
    "rule_key": "meter_working_space.width_ft",
    "source": "NEC 110.26(A)(2): 30 in wide working space",
    "placeholder": false
   },
   "margin_ft": 5.5807,
   "margin_over_uncertainty": 14.011
  },
  {
   "id": "gas_clearance",
   "scope": "candidate",
   "candidate_id": "spot",
   "outcome": "unsure",
   "reason": "Not everything within 3 ft 0 in of the battery was seen, so a gas meter or pipe could hide there.",
   "measured": null,
   "threshold": {
    "value_ft": 3.0,
    "comparison": "at_least",
    "rule_key": "clearances.gas_ft",
    "source": "Base help page: 3 ft from the gas meter; Austin Energy \u00a71.9; Texas Gas Service",
    "placeholder": false
   },
   "unsure_cause": "unobserved"
  },
  {
   "id": "ac_clearance",
   "scope": "candidate",
   "candidate_id": "spot",
   "outcome": "unsure",
   "reason": "Not everything within 3 ft 0 in of the battery was seen, so a AC unit could hide there.",
   "measured": null,
   "threshold": {
    "value_ft": 3.0,
    "comparison": "at_least",
    "rule_key": "clearances.ac_ft",
    "source": "Base help page: 3 ft from AC units, fences and other batteries",
    "placeholder": false
   },
   "unsure_cause": "unobserved"
  },
  {
   "id": "drive_clearance",
   "scope": "candidate",
   "candidate_id": "spot",
   "outcome": "unsure",
   "reason": "Not everything within 5 ft 0 in of the battery was seen, so a drivable surface could hide there.",
   "measured": null,
   "threshold": {
    "value_ft": 5.0,
    "comparison": "at_least",
    "rule_key": "clearances.drive_ft",
    "source": "No public value (docs/01 rules table: TBD)",
    "placeholder": true
   },
   "unsure_cause": "unobserved"
  },
  {
   "id": "pool_clearance",
   "scope": "candidate",
   "candidate_id": "spot",
   "outcome": "unsure",
   "reason": "Not everything within 10 ft 0 in of the battery was seen, so a pool could hide there.",
   "measured": null,
   "threshold": {
    "value_ft": 10.0,
    "comparison": "at_least",
    "rule_key": "clearances.pool_ft",
    "source": "No public value (docs/01 rules table: TBD); the demo ring drawn in docs/eli5.html",
    "placeholder": true
   },
   "unsure_cause": "unobserved"
  },
  {
   "id": "opening_clearance",
   "scope": "candidate",
   "candidate_id": "spot",
   "outcome": "fail",
   "reason": "objects[3] window is 0 ft 0 in (\u00b1 0 ft 4 in) from the battery; the rule needs more than 3 ft 0 in.",
   "measured": {
    "value_ft": 0.0,
    "plus_minus_ft": 0.3701,
    "coverage": [
     {
      "region": {
       "wall_id": "w1",
       "s_m": [
        -3.7793972584000004,
        -1.1719973600000002
       ],
       "height_m": [
        0.05,
        2.13
       ]
      },
      "status": "observed",
      "probes": 567,
      "observed_share": 1.0,
      "seen_share": 1.0,
      "views_min": 3,
      "views_median": 7.0,
      "best_incidence_deg": 4.0,
      "worst_best_incidence_deg": 17.8,
      "rule": {
       "min_views": 2,
       "surface": "wall",
       "max_incidence_deg": 75.0,
       "observed_share": 0.9
      },
      "method": "evalharness.coverage.query_region"
     }
    ],
    "subject": "objects[3] window"
   },
   "threshold": {
    "value_ft": 3.0,
    "comparison": "at_least",
    "rule_key": "clearances.opening_ft",
    "source": "IRC 2021 R328.4: 3 ft from doors and windows directly entering the dwelling. Applying it to garage doors (openings.types) is a demo choice the code does not require",
    "placeholder": false
   },
   "margin_ft": -3.0,
   "margin_over_uncertainty": -8.106
  },
  {
   "id": "wall_equipment_above",
   "scope": "candidate",
   "candidate_id": "spot",
   "outcome": "pass",
   "reason": "Nothing is mounted on the wall above the battery.",
   "measured": null,
   "threshold": {
    "value_ft": 0.0,
    "comparison": "at_least",
    "rule_key": "clearances.wall_equipment_ft",
    "source": "No public value; 0 means only overlap fails",
    "placeholder": true
   },
   "fact": {
    "value": true,
    "clean": true,
    "raw": "pass",
    "coverage": [
     {
      "region": {
       "wall_id": "w1",
       "s_m": [
        -3.7793972584000004,
        -1.1719973600000002
       ],
       "height_m": [
        0.05,
        2.13
       ]
      },
      "status": "observed",
      "probes": 567,
      "observed_share": 1.0,
      "seen_share": 1.0,
      "views_min": 3,
      "views_median": 7.0,
      "best_incidence_deg": 4.0,
      "worst_best_incidence_deg": 17.8,
      "rule": {
       "min_views": 2,
       "surface": "wall",
       "max_incidence_deg": 75.0,
       "observed_share": 0.9
      },
      "method": "evalharness.coverage.query_region"
     }
    ]
   }
  },
  {
   "id": "facing_gap",
   "scope": "candidate",
   "candidate_id": "spot",
   "outcome": "pass",
   "reason": "The gap in front of the battery is 37 ft 4 in (\u00b1 0 ft 1 in), clear of the 3 ft 0 in rule.",
   "measured": {
    "value_ft": 37.310367,
    "plus_minus_ft": 0.0984,
    "coverage": [
     {
      "region": {
       "wall_id": "w1",
       "s_m": [
        -2.8693972584000003,
        -2.0819973600000004
       ],
       "out_m": [
        0.1,
        11.9309998616
       ],
       "height_m": [
        0.3,
        1.83
       ]
      },
      "status": "observed",
      "probes": 6664,
      "observed_share": 1.0,
      "seen_share": 1.0,
      "views_min": 3,
      "views_median": 7.0,
      "best_incidence_deg": null,
      "worst_best_incidence_deg": null,
      "rule": {
       "min_views": 2,
       "surface": "free",
       "max_incidence_deg": null,
       "observed_share": 0.9
      },
      "method": "evalharness.coverage.query_region"
     }
    ],
    "subject": "facing[1]"
   },
   "threshold": {
    "value_ft": 3.0,
    "comparison": "at_least",
    "rule_key": "facing.min_ft",
    "source": "Base help page: 3 ft from fences",
    "placeholder": false
   },
   "margin_ft": 34.3104,
   "margin_over_uncertainty": 348.683
  },
  {
   "id": "headroom",
   "scope": "candidate",
   "candidate_id": "spot",
   "outcome": "pass",
   "reason": "Nothing limits the headroom over the battery's stretch of wall.",
   "measured": null,
   "threshold": {
    "value_ft": 6.5,
    "comparison": "at_least",
    "rule_key": "headroom.min_ft",
    "source": "NEC 110.26(A)(3) working-space headroom, applied to the battery as a demo choice",
    "placeholder": true
   },
   "fact": {
    "value": true,
    "clean": true,
    "raw": "pass",
    "coverage": [
     {
      "region": {
       "wall_id": "w1",
       "s_m": [
        -2.8693972584000003,
        -2.0819973600000004
       ],
       "out_m": [
        0.1,
        0.5588
       ],
       "height_m": [
        0.3,
        2.13
       ]
      },
      "status": "observed",
      "probes": 320,
      "observed_share": 1.0,
      "seen_share": 1.0,
      "views_min": 7,
      "views_median": 8.0,
      "best_incidence_deg": null,
      "worst_best_incidence_deg": null,
      "rule": {
       "min_views": 2,